{
  "type": "AIEvaluationReport",
  "version": "0.7.0",
  "description": "Artifact contract for evidence-based AI application quality, safety, and operational evaluation.",
  "pathPattern": "agent-output/ai-evaluation-report/*.md",
  "status": {
    "heading": "## Status",
    "pattern": "PASS|FAIL|BLOCKED"
  },
  "provenance": {
    "heading": "## Provenance",
    "requiredIdentities": [
      "artifactType",
      "artifactVersion",
      "workflow",
      "workflowVersion",
      "roleBinding",
      "agentInstance"
    ]
  },
  "revision": {
    "heading": "## Revision",
    "pattern": "^[1-9][0-9]*$"
  },
  "evidence": {
    "heading": "## Evidence",
    "requiredFields": [
      "claim",
      "source",
      "reproduction",
      "result"
    ]
  },
  "statusInvariants": {
    "passRequiresCompleteEvidence": true,
    "passForbidsDemonstratedNonconformance": true,
    "failRequiresDemonstratedNonconformance": true,
    "blockedRequiresUnavailablePrerequisite": true
  },
  "statusSemantics": {
    "passDefinition": "Every required AI evaluation criterion within the declared scope is supported by reproducible evidence and satisfies its declared threshold or acceptance condition; required datasets, scenarios, baselines, safety checks, failure-mode checks, and operational evidence are present when applicable; and no required evaluated scenario demonstrates unacceptable behavior.",
    "failDefinition": "Reproducible evidence demonstrates that at least one required quality, safety, failure-mode, or operational criterion or threshold is not satisfied.",
    "blockedDefinition": "Required evidence, dataset, scenario, baseline, threshold, evaluation condition, environment, or other prerequisite necessary to evaluate a required criterion is unavailable, missing, or unverifiable.",
    "mixedConditionRule": "FAIL_ON_DEMONSTRATED_NONCONFORMANCE"
  },
  "allowedStatuses": [
    "PASS",
    "FAIL",
    "BLOCKED"
  ],
  "requiredHeadings": [
    "# AI Evaluation Report",
    "## Status",
    "## Provenance",
    "## Revision",
    "## Evidence",
    "## Summary",
    "## Evaluation Scope",
    "## Evaluation Data and Scenarios",
    "## Metrics, Thresholds, and Baselines",
    "## Results",
    "## Safety and Failure Analysis",
    "## Operational Evidence",
    "## Known Limitations",
    "## Required Fixes",
    "## Handoff Target"
  ]
}
